{
  "$schema": "https://json-schema.org/draft/2020-12/schema",
  "$id": "https://example.internal/crew/capabilities.schema.json",
  "title": "checkout-pinned crew capability register",
  "description": "Closed, runtime-owned grants. The register is the single place that says which seats may fan out, and a grant must carry everything the seat's command line needs: tools: [\"Task\"] for a claude seat, an extension and an agent definition together for a pi seat. A grant may name a package the HOST installed, and such a vendor grant must carry its tool names. Skill grants stay empty until checkout-pinned pi assets arrive, and advisor is reserved for a later runtime slice. The coding-agent adapter inventory under coding_agents is distinct from role/overlay agents subagent grants; JSON has no comments, so this description records that collision explicitly.",
  "type": "object",
  "required": [
    "schema_version",
    "updated_at",
    "roles",
    "local_providers",
    "coding_agents"
  ],
  "additionalProperties": false,
  "properties": {
    "schema_version": {
      "const": 1
    },
    "updated_at": {
      "type": "string",
      "pattern": "^\\d{4}-\\d{2}-\\d{2}$"
    },
    "coding_agents": {
      "type": "object",
      "patternProperties": {
        "^[a-z0-9][a-z0-9-]*$": {
          "$ref": "#/$defs/codingagent"
        }
      },
      "additionalProperties": false
    },
    "roles": {
      "type": "object",
      "required": [
        "lead",
        "planner",
        "builder",
        "reviewer",
        "tech-lead"
      ],
      "additionalProperties": false,
      "properties": {
        "lead": {
          "$ref": "#/$defs/grant"
        },
        "planner": {
          "$ref": "#/$defs/grant"
        },
        "builder": {
          "$ref": "#/$defs/grant"
        },
        "reviewer": {
          "$ref": "#/$defs/grant"
        },
        "tech-lead": {
          "$ref": "#/$defs/grant"
        }
      }
    },
    "local_providers": {
      "type": "object",
      "patternProperties": {
        "^[a-z0-9-]+$": {
          "$ref": "#/$defs/localprovider"
        }
      },
      "additionalProperties": false
    },
    "narrator": {
      "$ref": "#/$defs/localprovider"
    }
  },
  "$defs": {
    "localprovider": {
      "type": "object",
      "required": [
        "settings",
        "pi_provider",
        "base_url"
      ],
      "additionalProperties": false,
      "properties": {
        "settings": {
          "$ref": "#/$defs/relpath"
        },
        "pi_provider": {
          "type": "string",
          "pattern": "^[a-z0-9-]+$"
        },
        "base_url": {
          "type": "string",
          "pattern": "^https?://"
        },
        "model": {
          "type": "string",
          "pattern": "^[A-Za-z0-9][A-Za-z0-9._:\/-]{0,127}$",
          "description": "Narrator chat streams completion progress. The request refuses transfer below 1 byte per second for 60 seconds, uses a 10-second connection timeout, and retains a 300-second absolute backstop. A 2026-09-13 transport probe of gpt-oss-20b observed first streamed bytes at 28.345s and completion at 29.305s; prior non-streaming measurements were 6.6s for gpt-oss-20b, 12.6s for qwen3.8-27b, and 35.2s warm / 44.0s cold for gemma4-31b. Choose a model whose initial silent interval stays below the 60-second stall window; once bytes arrive, continued progress rather than total duration governs acceptance. Any stall, connection failure, or absolute timeout degrades to the code-composed body."
        }
      }
    },
    "codingagent": {
      "type": "object",
      "required": [
        "providers",
        "transports",
        "adapter",
        "refuses",
        "display_name",
        "binary",
        "install_hint",
        "availability",
        "availability_reason"
      ],
      "additionalProperties": false,
      "oneOf": [
        {
          "properties": {
            "availability": { "const": "executable" },
            "availability_reason": { "const": "executable" }
          }
        },
        {
          "properties": {
            "availability": { "const": "proposal-stub" },
            "availability_reason": { "enum": ["proposal-stub", "adapter-import-failed"] }
          }
        },
        {
          "properties": {
            "availability": { "const": "discovered-unavailable" },
            "availability_reason": {
              "enum": ["discovered-unavailable", "shim-not-binary", "version-spawn-failed", "version-interrupted"]
            }
          }
        },
        {
          "properties": {
            "availability": { "const": "installed-unconfigured" },
            "availability_reason": { "enum": ["installed-unconfigured", "transport-refused"] }
          }
        }
      ],
      "properties": {
        "default_transport": { "enum": ["pane", "headless-json", "headless-rpc", "acp"] }, "display_name": {
          "type": "string",
          "pattern": "^\\S(?:.*\\S)?$"
        },
        "binary": {
          "type": "string",
          "pattern": "^[A-Za-z0-9][A-Za-z0-9._-]*$"
        },
        "install_hint": {
          "type": "string",
          "pattern": "^\\S(?:.*\\S)?$"
        },
        "availability": { "enum": ["executable", "discovered-unavailable", "installed-unconfigured", "proposal-stub"] },
        "availability_reason": {
          "enum": [
            "executable",
            "proposal-stub",
            "adapter-import-failed",
            "discovered-unavailable",
            "shim-not-binary",
            "version-spawn-failed",
            "version-interrupted",
            "installed-unconfigured",
            "transport-refused"
          ]
        },
        "config": {
          "type": "array",
          "items": {
            "type": "string",
            "pattern": "^\\S(?:.*\\S)?$"
          }
        },
        "providers": {
          "type": "array",
          "minItems": 1,
          "items": {
            "type": "string",
            "pattern": "^[a-z0-9][a-z0-9-]*$"
          }
        },
        "transports": {
          "type": "array",
          "minItems": 1,
          "items": {
            "enum": [
              "pane",
              "headless-json",
              "headless-rpc",
              "acp"
            ]
          }
        },
        "adapter": {
          "$ref": "#/$defs/relpath"
        },
        "refuses": {
          "type": "array",
          "items": {
            "enum": [
              "extensions",
              "skills",
              "mcp_servers",
              "local_provider"
            ]
          }
        }
      }
    },
    "relpath": {
      "type": "string",
      "pattern": "^[A-Za-z0-9._-]+(/[A-Za-z0-9._-]+)*$"
    },
    "grant": {
      "type": "object",
      "required": [
        "tools",
        "extensions",
        "agents",
        "skills",
        "advisor",
        "requires",
        "mcp_servers"
      ],
      "additionalProperties": false,
      "properties": {
        "tools": {
          "type": "array",
          "items": {
            "type": "string",
            "pattern": "^[A-Za-z0-9_-]+$"
          }
        },
        "extensions": {
          "type": "array",
          "items": {
            "$ref": "#/$defs/relpath"
          }
        },
        "agents": {
          "type": "array",
          "items": {
            "$ref": "#/$defs/agentgrant"
          }
        },
        "skills": {
          "type": "array",
          "items": {
            "$ref": "#/$defs/relpath"
          }
        },
        "advisor": {
          "type": "boolean"
        },
        "requires": {
          "type": "array",
          "items": {
            "enum": [
              "prompt_file",
              "tool_deny",
              "unattended",
              "subagents",
              "effort",
              "session_resume",
              "reassign"
            ]
          }
        },
        "vendor_extensions": {
          "type": "array",
          "items": { "$ref": "#/$defs/vendorgrant" }
        },
        "mcp_servers": {
          "type": "array",
          "items": { "$ref": "#/$defs/mcpserver" }
        },
        "by_agent": {
          "type": "object",
          "additionalProperties": false,
          "patternProperties": {
            "^[a-z0-9][a-z0-9-]*$": {
              "$ref": "#/$defs/agentoverlay"
            }
          }
        }
      }
    },
    "agentoverlay": {
      "type": "object",
      "additionalProperties": false,
      "properties": {
        "extensions": {
          "type": "array",
          "items": { "$ref": "#/$defs/relpath" }
        },
        "agents": {
          "type": "array",
          "items": { "$ref": "#/$defs/agentgrant" }
        },
        "skills": {
          "type": "array",
          "items": { "$ref": "#/$defs/relpath" }
        },
        "vendor_extensions": {
          "type": "array",
          "items": { "$ref": "#/$defs/vendorgrant" }
        },
        "mcp_servers": {
          "type": "array",
          "items": { "$ref": "#/$defs/mcpserver" }
        }
      }
    },
    "mcpserver": {
      "type": "object",
      "required": [
        "name",
        "command",
        "url"
      ],
      "additionalProperties": false,
      "properties": {
        "name": {
          "type": "string",
          "pattern": "^[A-Za-z][A-Za-z0-9._-]*$"
        },
        "command": {
          "type": ["object", "null"],
          "properties": {
            "bin": {
              "type": "string",
              "pattern": ".*\\S.*"
            },
            "args": {
              "type": "array",
              "items": { "type": "string" }
            }
          },
          "required": ["bin", "args"],
          "additionalProperties": false
        },
        "url": {
          "type": ["string", "null"],
          "pattern": "^https?://"
        }
      }
    },
    "vendorgrant": {
      "type": "object",
      "required": [
        "package",
        "tools"
      ],
      "additionalProperties": false,
      "properties": {
        "package": {
          "type": "string",
          "pattern": "^(@[a-z0-9][a-z0-9._-]*/)?[a-z0-9][a-z0-9._-]*$"
        },
        "tools": {
          "type": "array",
          "minItems": 1,
          "items": {
            "type": "string",
            "pattern": "^[A-Za-z0-9_-]+$"
          }
        },
        "optional": { "type": "boolean" }
      }
    },
    "agentgrant": {
      "type": "object",
      "required": [
        "name",
        "def"
      ],
      "additionalProperties": false,
      "properties": {
        "name": {
          "type": "string",
          "pattern": "^[A-Za-z][A-Za-z0-9_-]*$"
        },
        "def": {
          "$ref": "#/$defs/relpath"
        }
      }
    }
  }
}
