{
  "schema_version": 1,
  "updated_at": "2026-09-23",
  "coding_agents": {
    "pi": {
      "providers": [
        "openai",
        "anthropic",
        "meta",
        "llama-swap"
      ],
      "transports": [
        "pane",
        "headless-rpc",
        "acp"
      ],
      "adapter": "crew/adapters/adapter-pi.mjs",
      "refuses": [],
      "display_name": "Pi",
      "binary": "pi",
      "install_hint": "Install Pi and ensure the pi binary is on PATH.",
      "availability": "executable",
      "availability_reason": "executable"
    },
    "claude": {
      "providers": [
        "anthropic"
      ],
      "transports": [
        "pane",
        "headless-json",
        "acp"
      ],
      "adapter": "crew/adapters/adapter-claude.mjs",
      "refuses": [
        "extensions",
        "local_provider"
      ],
      "display_name": "Claude Code",
      "binary": "claude",
      "install_hint": "Install Claude Code and ensure the claude binary is on PATH.",
      "availability": "executable",
      "availability_reason": "executable"
    }
  },
  "roles": {
    "lead": {
      "tools": [],
      "extensions": [],
      "agents": [],
      "skills": [],
      "advisor": false,
      "requires": [],
      "mcp_servers": [],
      "by_agent": {
        "pi": {
          "skills": []
        },
        "claude": {
          "skills": []
        }
      }
    },
    "planner": {
      "tools": [
        "Task"
      ],
      "extensions": [],
      "agents": [],
      "skills": [],
      "advisor": false,
      "requires": [
        "subagents"
      ],
      "mcp_servers": [],
      "by_agent": {
        "pi": {
          "extensions": [
            "crew/pi/extensions/subagent.ts",
            "crew/pi/extensions/readgate.ts",
            "crew/pi/extensions/submit.ts"
          ],
          "mcp_servers": [{ "name": "lab", "command": { "bin": "node", "args": ["crew/mcp/lab-server.mjs"] }, "url": null }],
          "skills": [],
          "agents": [
            {
              "name": "scout",
              "def": "crew/pi/agents/scout.json"
            }
          ]
        },
        "claude": {
          "skills": []
        }
      }
    },
    "builder": {
      "tools": [],
      "extensions": [],
      "agents": [],
      "skills": [],
      "advisor": true,
      "requires": [],
      "mcp_servers": [],
      "by_agent": {
        "pi": {
          "mcp_servers": [
            {
              "name": "fff",
              "command": {
                "bin": "/opt/homebrew/bin/fff-mcp",
                "args": []
              },
              "url": null
            }
          ],
          "extensions": [
            "crew/pi/extensions/builderloop.ts",
            "crew/pi/extensions/readgate.ts",
            "crew/pi/extensions/skeletonread.ts",
            "crew/pi/extensions/submit.ts",
            "crew/pi/extensions/reminders.ts"
          ],
          "skills": []
        },
        "claude": {
          "skills": [],
          "mcp_servers": [
            {
              "name": "fff",
              "command": {
                "bin": "/opt/homebrew/bin/fff-mcp",
                "args": []
              },
              "url": null
            }
          ]
        }
      }
    },
    "reviewer": {
      "tools": [
        "Task"
      ],
      "extensions": [],
      "agents": [],
      "skills": [],
      "advisor": false,
      "requires": [],
      "mcp_servers": [],
      "by_agent": {
        "pi": {
          "extensions": [
            "crew/pi/extensions/submit.ts"
          ],
          "skills": [
            "skills/code-less/SKILL.md"
          ]
        },
        "claude": {
          "skills": [
            "skills/code-less/SKILL.md"
          ]
        }
      }
    },
    "tech-lead": {
      "tools": [],
      "extensions": [],
      "agents": [],
      "skills": [],
      "advisor": false,
      "requires": [],
      "mcp_servers": [],
      "by_agent": {
        "pi": {
          "extensions": [
            "crew/pi/extensions/readgate.ts",
            "crew/pi/extensions/submit.ts"
          ],
          "skills": []
        },
        "claude": {
          "skills": []
        }
      }
    }
  },
  "local_providers": {
    "llama-swap": {
      "settings": "crew/pi/settings.json",
      "pi_provider": "llama-swap",
      "base_url": "http://10.112.20.20:8080/v1"
    }
  },
  "narrator": {
    "settings": "crew/pi/settings.json",
    "pi_provider": "llama-swap",
    "base_url": "http://10.112.20.20:8080/v1",
    "model": "qwen3.8-27b"
  }
}
